{
  "format_version": "1.0",
  "library_revision": 7,
  "catalogue_version": "1.0.0",
  "sql_dialect": "oracle",
  "authority": "Canonical SQL bodies; graph and historical batch files are not current SQL authoring sources.",
  "source_batches": {
    "01": {
      "file_name": "Oracle-Occurrence-Templates.sql",
      "library_file_id": "libfile_2d6e814743448191b9ea4b252c115c8c",
      "sha256": "146196906f44a0de489c60df996c5f8bdfab079c225c9779d09a921b50e536f1",
      "usage_notes": "-- Oracle occurrence-count predicates U01-U03\n-- Replace placeholders before running. Run one SELECT at a time.\n-- Key/record columns must be eligible Oracle PARTITION BY expressions.\n\n\n-- # Oracle occurrence-count predicates — first authored pattern\n-- \n-- One base pattern supplies six predicates. Catalogue release 1.0.0 remains frozen.\n-- \n-- | Axis | Group by | Once | More than once |\n-- |---|---|---|---|\n-- | U01 | One selected column | U01.1 Uniqueness | U01.2 Non-uniqueness |\n-- | U02 | Selected composite-key columns | U02.1 Composite uniqueness | U02.2 Composite non-uniqueness |\n-- | U03 | Explicit record-comparison projection | U03.1 Record uniqueness | U03.2 Record duplication |\n-- \n-- All six return original rows plus `profile_occurrence_count`. The two branches select count = 1 and count > 1. Every member of a repeated group is returned, including its first occurrence. There is no DISTINCT, representative-row selection or concatenation of key columns.\n-- \n-- ## Customization\n-- \n-- `{{schema_name}}`, `{{table_name}}` and `{{column_name}}` are identifier placeholders. `{{key_columns}}` and `{{comparison_columns}}` are comma-separated, alias-qualified column lists, such as `t.COL1, t.COL2`. The application supplies those names later. Quote individual identifiers when required by the database. These braces are substitution markers, not Oracle SQL syntax or bind variables.\n-- \n-- Change `WHERE 1 = 1` inside the inner query to restrict the population, for example `WHERE t.ELECTION_ID = :election_id`. Both branches must use the same restriction. To exclude nulls from an investigation, add the appropriate non-null condition there; the supplied default deliberately includes null groups. For a composite key, decide explicitly whether all components must be non-null.\n-- \n-- U03 compares the declared projection, not every displayed field automatically. A unique row identifier or audit timestamp should be included only if it belongs to the intended definition of record equality. Source rows are still returned in full so they can be inspected.\n-- \n-- The derived alias `profile_occurrence_count` must not collide with a source column. If it does, change it both where calculated and where filtered. Unsupported partition types, including LOB content, need a separate variant; no implicit truncation or hashing is supplied.\n-- \n-- ## Meaning and validation\n-- \n-- The default includes null-key groups, in accordance with the approved catalogue. Composite keys are compared as tuples. Empty populations return no rows. No case/whitespace normalization or conversion is introduced; Oracle's datatype and collation semantics govern grouping.\n-- \n-- The local fixture checks duplicates, null groups, partial-null tuples, distinct tuples that would collide under naive concatenation, changing comparison projections, filtering before counting, excluding nulls, singleton-null input, and empty input. The exact generated query structures were run using SQLite window functions as a portable logic check. **They have not been run against Oracle.** SQLite checks do not establish Oracle collation, datatype or optimizer behavior.\n-- \n-- \n-- ## Primary references\n-- \n-- - [Oracle 19c COUNT](https://docs.oracle.com/en/database/oracle/oracle-database/19/sqlrf/COUNT.html): COUNT(*) counts all rows, including rows containing nulls.\n-- - [Oracle 19c analytic functions](https://docs.oracle.com/en/database/oracle/oracle-database/19/sqlrf/Analytic-Functions.html): multi-expression partitions and filtering analytic results in an outer query.\n-- ",
      "prior_portable_checks_reported": 12,
      "historical_test_rerun": false,
      "historical_usage_notes": "-- Oracle occurrence-count predicates U01-U03\n-- Replace placeholders before running. Run one SELECT at a time.\n-- Key/record columns must be eligible Oracle PARTITION BY expressions.\n\n\n-- # Oracle occurrence-count predicates — first authored pattern\n-- \n-- One base pattern supplies six predicate SQL properties. Catalogue release 1.0.0 remains frozen; the graph advances to revision 2.\n-- \n-- | Axis | Group by | Once | More than once |\n-- |---|---|---|---|\n-- | U01 | One selected column | U01.1 Uniqueness | U01.2 Non-uniqueness |\n-- | U02 | Selected composite-key columns | U02.1 Composite uniqueness | U02.2 Composite non-uniqueness |\n-- | U03 | Explicit record-comparison projection | U03.1 Record uniqueness | U03.2 Record duplication |\n-- \n-- All six return original rows plus `profile_occurrence_count`. The two branches select count = 1 and count > 1. Every member of a repeated group is returned, including its first occurrence. There is no DISTINCT, representative-row selection or concatenation of key columns.\n-- \n-- ## Customization\n-- \n-- `{{schema_name}}`, `{{table_name}}` and `{{column_name}}` are identifier placeholders. `{{key_columns}}` and `{{comparison_columns}}` are comma-separated, alias-qualified column lists, such as `t.COL1, t.COL2`. The application supplies those names later. Quote individual identifiers when required by the database. These braces are substitution markers, not Oracle SQL syntax or bind variables.\n-- \n-- Change `WHERE 1 = 1` inside the inner query to restrict the population, for example `WHERE t.ELECTION_ID = :election_id`. Both branches must use the same restriction. To exclude nulls from an investigation, add the appropriate non-null condition there; the supplied default deliberately includes null groups. For a composite key, decide explicitly whether all components must be non-null.\n-- \n-- U03 compares the declared projection, not every displayed field automatically. A unique row identifier or audit timestamp should be included only if it belongs to the intended definition of record equality. Source rows are still returned in full so they can be inspected.\n-- \n-- The derived alias `profile_occurrence_count` must not collide with a source column. If it does, change it both where calculated and where filtered. Unsupported partition types, including LOB content, need a separate variant; no implicit truncation or hashing is supplied.\n-- \n-- ## Meaning and validation\n-- \n-- The default includes null-key groups, in accordance with the approved catalogue. Composite keys are compared as tuples. Empty populations return no rows. No case/whitespace normalization or conversion is introduced; Oracle's datatype and collation semantics govern grouping.\n-- \n-- The local fixture checks duplicates, null groups, partial-null tuples, distinct tuples that would collide under naive concatenation, changing comparison projections, filtering before counting, excluding nulls, singleton-null input, and empty input. The exact generated query structures were run using SQLite window functions as a portable logic check. **They have not been run against Oracle.** SQLite checks do not establish Oracle collation, datatype or optimizer behavior. A separate read-only `Oracle-Occurrence-Smoke-Test.sql` is supplied for an Oracle-side check; it creates no database objects.\n-- \n-- The graph integrity validator still checks the frozen catalogue and relationships. It now permits authored SQL and requires each authored query to have a nonempty template, while unfilled predicates retain a null template. All six queries remain stored directly in the corresponding predicates' `attributes.sql.template` properties.\n-- \n-- ## Primary references\n-- \n-- - [Oracle 19c COUNT](https://docs.oracle.com/en/database/oracle/oracle-database/19/sqlrf/COUNT.html): COUNT(*) counts all rows, including rows containing nulls.\n-- - [Oracle 19c analytic functions](https://docs.oracle.com/en/database/oracle/oracle-database/19/sqlrf/Analytic-Functions.html): multi-expression partitions and filtering analytic results in an outer query.\n-- \n-- Next pattern: population uniqueness (U04 and U07) can reuse the occurrence-count idea but returns a population-level result, so it will be authored separately."
    },
    "02": {
      "file_name": "Oracle-Batch-02-Population-Uniqueness.sql",
      "library_file_id": "libfile_9fc8c9e5432c8191bd8f77703eaa1d93",
      "sha256": "28ce45fe5a79933a87d3a747c86c08320ed86d6e251fd32b4c7c0d55b9b16c82",